{
  "$schema": "http://json-schema.org/draft-07/schema#",
  "title": "Tomo Tag Handler Config",
  "description": "Schema for a single tag-handler config file (config/tag-handlers/<feature>.json). Defines matching rules, the action to perform, and how to compose the output. Spec: docs/XDD/specs/024-tag-handler-framework/",
  "type": "object",
  "required": ["id", "match", "action", "compose"],
  "additionalProperties": false,
  "properties": {
    "id": {
      "type": "string",
      "minLength": 1,
      "description": "Unique handler identifier; also used as the routing-plan marker."
    },
    "enabled": {
      "type": "boolean",
      "default": true,
      "description": "When false, the handler is skipped exactly like an invalid one."
    },
    "match": {
      "type": "object",
      "required": ["tag_prefix"],
      "additionalProperties": false,
      "properties": {
        "tag_prefix": {
          "type": "string",
          "minLength": 1,
          "description": "Tag prefix this handler matches (e.g. 'MiYo/Tsukai/')."
        },
        "capture_segments": {
          "type": "array",
          "items": {"type": "string", "minLength": 1},
          "description": "Names for suffix path segments after the prefix."
        },
        "read_fields": {
          "type": "array",
          "items": {"type": "string", "minLength": 1},
          "description": "Frontmatter fields exposed to the compose step."
        }
      }
    },
    "action": {
      "type": "string",
      "enum": ["insert_under_marker", "route_to_folder", "link_to_moc", "enrich_frontmatter"],
      "description": "Action registry v1 value. The resolver (not this schema) rejects declared-but-deferred actions at runtime."
    },
    "target": {
      "type": "object",
      "required": ["by", "map"],
      "additionalProperties": false,
      "properties": {
        "by": {
          "type": "string",
          "minLength": 1,
          "description": "Which capture segment key is used to look up the map."
        },
        "map": {
          "type": "object",
          "additionalProperties": {"type": "string"},
          "description": "Mapping from capture segment value to target vault path."
        }
      }
    },
    "marker": {
      "type": "string",
      "minLength": 1,
      "description": "Anchor string in the target note (e.g. '## Captures'). Transformed to anchor.value by the resolver."
    },
    "placement": {
      "type": "string",
      "enum": ["inside", "before", "after"],
      "description": "Where to insert relative to the matched anchor."
    },
    "compose": {
      "oneOf": [
        {
          "type": "string",
          "minLength": 1,
          "description": "LLM directive: free-text instruction for how to synthesize the batch."
        },
        {
          "type": "array",
          "items": {"type": "string", "minLength": 1},
          "minItems": 1,
          "description": "Mechanical template: ordered list of frontmatter field names to render."
        }
      ],
      "description": "How to compose the handler output. Either a string (LLM directive) or an array of field names (mechanical template)."
    },
    "output_format": {
      "$comment": "CON-1 DRIFT GUARD: this object's property names and types are structurally identical to output_format in tag-handler-group.schema.json (descriptions differ intentionally: config view vs group-result view). Any structural change here MUST be mirrored there, and vice versa. Spec: docs/XDD/specs/025-structure-aware-tag-handler-compose/ ADR-2.",
      "type": "object",
      "description": "OPTIONAL — structure-aware rendering spec. Absent ⇒ today's prose-block behaviour. Spec: docs/XDD/specs/025-structure-aware-tag-handler-compose/ (FR-15, FR-18).",
      "required": ["structure", "order", "granularity", "cells"],
      "additionalProperties": false,
      "properties": {
        "structure": {
          "type": "string",
          "enum": ["table_row", "list_item"],
          "description": "Output block shape: table_row = one Markdown table row per item; list_item = one bullet per item."
        },
        "order": {
          "type": "string",
          "enum": ["append", "newest_first"],
          "description": "Insertion order relative to existing rows/items under the anchor."
        },
        "granularity": {
          "type": "string",
          "enum": ["per_item", "merged"],
          "description": "per_item = one row/bullet per inbox item; merged = LLM-merged single block."
        },
        "cells": {
          "type": "array",
          "minItems": 1,
          "description": "Ordered cell definitions. Each cell is either a direct field projection or an LLM synthesis directive (FR-18).",
          "items": {
            "oneOf": [
              {
                "type": "object",
                "required": ["field"],
                "additionalProperties": false,
                "properties": {
                  "field": {
                    "type": "string",
                    "minLength": 1,
                    "description": "Frontmatter field name to project verbatim into this cell."
                  }
                }
              },
              {
                "type": "object",
                "required": ["synthesize"],
                "additionalProperties": false,
                "properties": {
                  "synthesize": {
                    "type": "string",
                    "minLength": 1,
                    "description": "LLM directive for synthesizing this cell's content from the batch."
                  }
                }
              }
            ]
          }
        },
        "join": {
          "type": "string",
          "default": " — ",
          "description": "Separator between cells for list_item structure. Ignored for table_row (cells map to columns). Default: ' — '."
        }
      }
    }
  }
}
